timestamp	phase	score	words	keep_discard	description
discarded	foundation	-1.0	0	discard	Iteration 5: no improvement (-1.0 <= 0.0)
29f5967	foundation	5.0	0	keep	Iteration 2: score improved 0.0 -> 5.0
discarded	foundation	5.0	0	discard	Iteration 7: no improvement (5.0 <= 5.0)
2181a22	foundation	8.0	0	keep	Iteration 8: score improved 5.0 -> 8.0
4762531	foundation	8.0	0	keep	Iteration 4: score improved 5.0 -> 8.0
464879d	foundation	8.0	0	keep	Iteration 1: score improved 0.0 -> 8.0
5d798f8	foundation	9.0	0	keep	Iteration 1: score improved 0.0 -> 9.0
